headline,label
"મિડકેપ શેરોમાં આજે પણ વેચવાલી, નિફ્ટી 10750ની નીચે",business
મોંઘુ-સોંઘુ: ઓગષ્ટમાં આ વસ્તુઓ તમારા ખિસ્સાને કરશે અસર,business
"સેન્સેક્સમાં 74 પૉઇન્ટનો વધારો, નિફ્ટી 10125ની પાસે",business
"એશિયાનો સૌથી મોટો રબર એક્સ્પો- મુંબઈમાં જાન્યુઆરી, 2019માં યોજાશે",business
"જો સરકાર સ્વીકારે વેનેઝુએલાની આ ઓફર, તો 30% સસ્તુ થઇ શેકે છે પેટ્રોલ-ડીઝલ",business
PM મોદીની બાયોપિકમાં જશોદાબેનનો રોલ ભજવશે આ અભિનેત્રી,entertainment
દેશના વિદેશી મુદ્રા ભંડારમાં 25 અબજ ડોલરથી વધારાનો ઘટાડો: રિઝર્વ બેંક,business
"Khatron Ke Khiladi 9માં અક્ષય કુમારની એન્ટ્રી, કહ્યું- 'મારી પત્નીને ન કહેતા'",entertainment
"કપિલનાં ચાહકો માટે ખરાબ સમાચાર, બંધ થઇ શકે છે 'ફેમિલી ટાઇમ'!",entertainment
"Oppoએ લોન્ચ કર્યો નવો ફોન, તેમા લાગેલો છે 'જાસુસી કેમેરા'",tech
"Caught & Clicked: આ ક્રિકેટરને ડેટ કરી રહી છે નિધિ અગ્રવાલ, જુઓ તસવીરો",entertainment
"FACEBOOKમાં આ એપ્સથી રહેવું દૂર, તમારા ડેટા ચોરી લેશે",entertainment
રેલવેની ખાસ સ્કિમ: વેઈટિગ ટિકિટ હોવાં છતાં મળશે કન્ફર્મ સીટ,business
"ટીવી પર ટૂંક સમયમાં પરત ફરશે BIG B, KBC-11 અંગે કરી જાહેરાત",entertainment
"1 લીટરમાં 60 કિમીથી વધુ માઈલેજ આપે છે આ 5 સ્કૂટર્સ, જાણો તેમની કિંમત",tech
આ ઈયરફોન ફટાફટ ટ્રાંસલેટ કરી દે છે પાંચ ભાષા,tech
બધાઈ હો! નીના ગુપ્તાની ફિલ્મ આગળ ટૂંકો પડ્યો ‘બાહુબલી’નો રેકોર્ડ,entertainment
VIDEO: શાહિદ અને શ્રદ્ધાની 'બત્તી ગુલ મિટર ચાલુ'નું ટ્રેલર થયુ રિલીઝ,entertainment
જો તમે જુનો ફોન એક્સચેન્જ કરવા માંગો છો તો અહીં મળી રહ્યું છે રુ.5000 સુધી ડિસ્કાઉન્ટ,tech
"હજુ પણ વધી શકે છે પેટ્રોલ અને ડીઝલના ભાવ,  જાણો શું છે કારણ",business
"હોમલોન 12વર્ષમાં સૌથી સસ્તી, ઘર ખરીદવા માટે અત્યારે સોનેરી તક",business
"એશિયા સ્પા એવોર્ડ્સ ફંકશનમાં બોલિવૂડ સિતારાઓનો જમાવડો, જુઓ Pics",entertainment
"flipkart પર ધમાકેદાર ઓફર,  Xiaomi Mi A1 અને iPhone 8 પર મળી રહ્યું છે મોટુ ડિસ્કાઉન્ટ",tech
બિટકોઈન શું છે? ક્યારથી થઈ શરૂઆત? કોણે કરી શોધ? જાણો - તેના વિશે બધુ જ,business
"આ છે રાજ બબ્બરની થનારી વહુ, પ્રતીક સાથે ગોવામાં કરી રહી છે મજા",entertainment
"હું ભાગેડું નથી, તપાસમાં સહયોગ કરતો રહીશઃ વિજય માલ્યા",business
સુહેલ સેઠે 18 વર્ષ નાની ગર્લફ્રેન્ડ લક્ષ્મી મેનન સાથે કર્યા લગ્ન,entertainment
"Jio SIMવાળા માટે આ છે ખાસ સર્વિસ, આજે જ કરો Activate",tech
"RBIની નવી નાણાકીય નીતિ જાહેર, વ્યાજ દરમાં ઘટાડો ન કર્યો",business
"મોટું પતલું, બાલવીર અને નિક જોન્સ વચ્ચે શું છે સમાનતા?",tech
દેશમાં શનિવારે પેટ્રોલ અને ડીઝલ 40 પૈસા સુધી સસ્તું થયું,business
"પોતાના સૌથી સસ્તા સ્માર્ટફોનની કિંમતમાં શાઓમીએ કર્યો મોટો ફેરફાર, જાણો નવી કિંમત",tech
"અનુષ્કાની ઝાટકણી બાદ મુંબઇવાસીનો પલટવાર, સોશિયલ મીડિયા પર લખી આવી પોસ્ટ",entertainment
"""મેક ઈન ઓડિશા સંમેલન-2018""માં મુકેશ અંબાણી કરશે સંબોધન",business
આશા ભોસલેના આ પગલાં બાદ લતાએ તોડી નાખ્યાં હતાં તમામ સંબંધ,entertainment
PHOTOS: વ્હાઇટ કેઝ્યુઅલમાં  સની લિયોનનો Simple & Sexy અવતાર,entertainment
"Appleએ ફરી શરુ કર્યુ  iPhone Xનું ઉત્પાદન, જાણો કારણ",tech
IPL સટ્ટામાં અભિનેતા અરબાઝ ખાન સામેલ? થાણે ક્રાઈમ બ્રાંચે મોકલ્યું સમન્સ,entertainment
'રૂદાલી' જેવી મહિલાપ્રધાન ફિલ્મોના દિગ્દર્શક કલ્પના લાજમીનું નિધન,entertainment
સોશિયલ મીડિયા પર બોલ્ડ ફોટોઝ શેર કરી ઇન્ટરનેટ સેંસેશન બની કરિશ્મા,entertainment
"SBIના કાર્ડધારકો ગુજરાત યુનિ.થી પૈસા ઉપાડી શકશે,બે માઈક્રો ATM મુકવામાં આવ્યા ",business
"Micromaxએ લોન્ચ કર્યા બે નવા સ્માર્ટફોન, જાણો કિંમત અને ફિચર્સ",tech
"આ કંપનીએ રજૂ કર્યો જબરદસ્ત પ્લાન,  90 દિવસ માટે કોલિંગ ફ્રી",tech
હવે પ્રિયંકા માટે આ ડિઝાઇનર તૈયાર કરશે લગ્નનું પાનેતર,entertainment
"એલર્ટ : SBIમાં કેશ ઉપાડવા અને જમા કરવાના નિયમો બદલાયા, જાણી લો",business
"ગુજરાતે વિકાસની વિરાટતાના દર્શન કરાવ્યા, 25 હજાર MoU થયા, શું છે ખાસ? જાણો",business
"આકાશમાં દેખાશે મેડ ઈન ઈન્ડિયા વિમાન, HAL દ્વારા કરાયુ છે સ્વદેશી વિમાનનું નિર્માણ",tech
જાણો જ્હાન્વીએ સોશિયલ મીડિયા પર કોને કહ્યું 'I LOVE YOU',entertainment
અમેરિકી ફેડરલ બેંકના વ્યાજ દરના વધારાના સામના માટે ભારત સજ્જ : નાણા મંત્રાલય,business
PHOTOS: VOGUE મેગેઝિન માટે સુહાના ખાનનું HOT ફોટોશૂટ,entertainment
ગૂગલ પર 'Bitches Near Me' સર્ચ કરવા પર ખુલી રહ્યું છે Girl સ્કૂલ-હોસ્ટેલનું લીસ્ટ,tech
"શાહરુખ ખાને દિવાળી પર રાખી 'બ્લેક થીમ', જુઓ અદભુત તસવીરો",entertainment
Bugdget 2018: આ 7 મહત્વનાં નિર્ણય પર હશે સૌની નજર,business
...જ્યારે અસલ જિંદગીમાં સલમાને રસ્તા વચ્ચે બીજાના કારણે ખાધો હતો માર,entertainment
PHOTOS: બોલિવૂડની હોટ સેલિબ્રિટીઝ જેઓ PETA માટે કરી ચુક્યા છે કામ,entertainment
SBIના આ કાર્ડ વિશે જાણો છો? ટ્રેન ટિકિટ બુક કરાવવાનું પડશે સસ્તુ,business
"સમગ્ર અંબાણી પરિવારે સ્ટેજ પર પહોંચી કર્યો ગ્રૃપ ડાન્સ, જુઓ વીડિયો",entertainment
"બજારમાં આવશે નવી ચલણી નોટ, શું હશે ખાસિયતો? જાણો",business
"ખુશખબર! SBI ગ્રાહક રોજ મોકલી શકશે આટલા રૂપિયા, બેંકે બદલ્યો નિયમ",business
"બકરી પર ગેંગરેપ પર ફરહાન બોલ્યો, 'આપણી ઉત્ક્રાંતિમાં કંઇક ખોટુ થઇ રહ્યું છે'",entertainment
"Flipkart republic Day Sale: સ્માર્ટફોન્સ પર રૂપિયા 8 હજાર છૂટ, SBI card પર છે, ખાસ ઑફર",tech
પેન્ટ પહેરવાનું ભૂલી ગઇ કાજોલની દીકરી ન્યાસા! થઇ ટ્રોલિંગનો શિકાર,entertainment
ઓનલાઈન બેંકિંગમાં આ વાતોનું રાખજો ધ્યાન નહીં તો થશે મોટું નુકશાન,business
"રૂપિયા માટે વહેલી સવારથી બેંકો બહાર લાઇનો, પોલીસ બંદોબસ્ત ગોઠવાયો, જુઓ તસ્વીરો",business
"શેર બજાર કડકભૂસ, સેંસેક્સ 1000,નિફ્ટીમાં 300પોઇન્ટનો કડાકો",business
"ટીવીની આ એક્ટ્રેસે કરાવ્યું બોલ્‍ડ ફોટોશૂટ, જોઈને હોંશ ઉડી જશે",entertainment
"હિના ખાન બની ટોલર્સનો શિકાર, જિમ આઉટફિટ પર કરવામાં આવી ટિપ્પણી",entertainment
"આ બેન્કે બેટરીથી સંચાલિત પ્રથમ   ક્રેડિટ કાર્ડ બનાવ્યું, જાણો વિશેષતાઓ",business
"શ્રીદેવીના નિધનથી બોલિવૂડમાં સન્નાટો, જુઓ તેમની છેલ્લી તસવીરો",entertainment
"SBI ગ્રાહક હવે મિનિટોમાં જ ટ્રાન્સફર કરી શકશે પૈસા, શરૂ થઈ આ સુવિધા",business
કોંગ્રેસે છ દાયકામાં શું કર્યું? બ્લેક મની માટે નવી શું છે યોજના? જાણો,business
"પતંજલિ આપશે 34 હજાર લોકોને નોકરી, જાણો શું છે પ્રોસેસ",business
"બ્રિટનના રોયલ ફેમિલીની નાની વહુએ ડ્રેસ પહેરવામાં કરી મોટી ભૂલ, ઉડી મજાક",entertainment
શું તમે જાણો છો કે USB કેબલમાં ત્રિશુલનું નિશાન કેમ હોય છે?,tech
આવી રીતે કોમ્પ્યુટર પર એક સાથે ચલાવો વોટ્સએપના બે એકાઉન્ટ,tech
"12 માર્ચે લોન્ચ થશે, Honor 7C સ્માર્ટફોન, જાણો ફિચર્સ અને કિંમત",tech
"પ્રિયંકા-નિક આપશે ચોથું રિસેપ્શન, આ જગ્યાએ કરશે સેલિબ્રેશન",entertainment
"મહિન્દ્રાએ ભારતમાં લોન્ચ કરી Mahindra XUV300, જાણો કિંમત",tech
"ઓછી મૂડીમાં નાખો ક્રિકેટ બોલ બનાવવાની ફેક્ટરી, થશે સારી કમાણી",business
"મહિલાઓએ ખેતીમાં લાખોની કમાણી કરી,રાજ્યપાલે આપ્યો એવોર્ડ",business
OMG : આ એકટ્રેસના પતિએ આપી ઓન-સ્ક્રીન ન્યૂડ થવાની પરવાનગી,entertainment
સેલ્ફી શોખીનો માટે લોન્ચ થયો Honorનો આ શાનદાર સ્માર્ટફોન,tech
સિંગતેલમાં 15 કિલોના ડબ્બાનો ભાવ રૂ.20સુધી ઘટ્યો,business
પાકિસ્તાનમાં બચ્ચન અને માધુરી દિક્ષીત કરી રહ્યા છે ચૂંટણી પ્રચાર!,entertainment
"અક્કીનો જોવા મળ્યો અલગ લૂક, ટ્વિંકલ સાથે લોન્ચ કર્યું પેડમેનનું સોન્ગ",entertainment
"પ્રિયંકા-નિકની સંગીત સેરેમનીની અંદરની તસવીરો આવી સામે, જુઓ ફંક્શનમાં જલસો",entertainment
વિક્ટોરિયા સિક્રેટ્સ 2018 : પરી બનીને રેમ્પ પર ઉતરી મોડલ્સ જુઓ તેમનો જલવો,entertainment
હવે આ નવું કોણ નાગિનના રોલમાં આવી રહ્યું છે?,entertainment
જાણો હવે ક્યારે લોન્ચ થશે Redmi Note5 અને  Note5 Pro,tech
એપલના iPhone Xથી પણ મોંઘો હશે LGનો આ નવો ફોન,tech
શ્રીદેવીના નિધન પર કોંગ્રેસે કરી એવી ટ્વિટ કે લોકોએ દર્શાવી આપત્તિ,entertainment
Hot pics: મંદાના કરીમીએ શેર કર્યા ટોપલેસ ફોટા,entertainment
રિલાયન્સ ઇન્ડસ્ટ્રીઝના ચેરમેનના પગારમાં 10મા વર્ષે પણ કોઈ વધારો નહિ,business
"'ધડક'ની ટીમ સાથે પાર્ટી કરતા જોવા મળ્યા ઈશાન-જ્હાનવી, જુઓ Pics",entertainment
ઇન્ડિયન 'Kim Kardashian' Gizeleનો બોલ્ડ અંદાજ,entertainment
"સ્કૂલમાં 'કાલી પરી' કહીને ચીડાવતા, આજે દુનિયામાં 'ઇન્ડિયન રિહાના' નામથી પોપ્યુલર",entertainment
"PM મોદી પર બની શોર્ટ ફિલ્મ, અત્યાર સુધીમાં 29 લાખ લોકોએ જોયુ ટ્રેલર",entertainment
"વડોદરાઃપંદર વર્ષ જુની ઇમારતોએ સ્ટ્ર્ક્ચર સર્ટિ લેવું પડશે,અમુલ એપાર્ટમેન્ટની ઘટના બાદ તંત્ર જાગ્યુ",business
"B'day: આજે ઐશ્વર્યાનો 45મો જન્મ દિવસ, જુઓ તેની યાદગાર તસવીરો",entertainment
"પ્રિયંકાના પતિ નિક જોનસ પર બની રહી છે ડોક્યુમેન્ટ્રી, અહીં જોઇ શકશો તમે",entertainment
"જેલના સળિયા પાછળ શરૂ થયો સ્ટાર્ટઅપ, થયો SUPER HIT",business
"'ઉરી'ની સક્સેસ પાર્ટીમાં આવ્યા સ્ટાર્સ, રાધિકાનો બોલ્ડ અંદાજ",entertainment
દેશ-વિદેશમાં કચ્છી વણાટ શાલને લોગોથી મળશે નવી ઓળખ,business
"પહેલી વખત જોવા મળ્યો સુહાનાનો સ્પોર્ટી અંદાજ, સંગીત ખુરશી રમતો Video Viral",entertainment
નોટબંધી 2.0 : બેંકમાં જમા તમારા પૈસા થઇ શકે છે ગાયબ !,business
"શાહરુખના બંગલા મન્નતને દુલ્હનની જેમ શણગારવામાં આવી રહ્યો છે, જુઓ તસવીરો",entertainment
"માત્ર બે દિવસમાં છોડી દીધી એન્જિનિયરિંગ, આવી રીતે ઉભી કરી રૂ. 28 હજાર કરોડની કંપની",business
શો બંધ થતાં જ સુનીલ ગ્રોવરે લંબાવ્યો કપિલ શર્મા તરફ મૈત્રીનો હાથ,entertainment
એક સમયે ઝુંપડીમાં દિવસો પસાર કર્યા હતા કાદર ખાને,entertainment
"દિવ્યાંગ માટે બનાવાઈ 'દિવ્યાંગ સારથી' એપ, જીવન બનશે થોડુ સરળ",tech
કર્લી હેર અને ન્યૂડ લિપ્સ્ટિકમાં આ એક્ટ્રેસ લાગી રહી છે એકદમ હટકે,entertainment
Bollywood Diwali : શિલ્પાથી લઇને કરીનાનો દિવાળી લૂક,entertainment
આ નિયમ લાગુ થયો તો WhatsAppને ભારતમાંથી સમેટવા પડશે બોરિયા-બિસ્તરા,tech
"Game of Thronesનું ટ્રેલર રીલિઝ, 14 એપ્રિલથી શરૂ થશે રોમાંચ",entertainment
"ખાતામાં ઓછું બેલેન્સ હોવા પર નહીં લાગે પેનલ્ટી, સમજો SBIનું ગણિત",business
"Sonchiriya: ફિલ્મનું બીજું ટ્રેલર રીલિઝ, દમદાર ડાયલોગ બોલી રહ્યો છે સુશાંત",entertainment
"MWC 2019: LGએ લોન્ચ કર્યા ત્રણ સ્માર્ટફોન, જાણો શું છે નવું?",tech
વાજપેયીની યાદમાં શાહરુખે લખ્યો ભાવુક સંદેશ- 'લવ યુ બાપજી',entertainment
આ છે દુનિયાનો પહેલો એવો ફોન જેના પાછળ લાગ્યા છે ત્રણ કેમેરા,tech
"દેશમાં પહેલીવાર રૂ.200ની નોટ, શુક્રવારના રોજ એટલે કે આવતીકાલે લોન્ચ કરાશે",business
"ALERT: નથી સુરક્ષિત તમારું WhatsApp, કોઇ અન્યનાં ફોનમાં ખુલી રહી છે Chat",tech
તો હવે 'તારક મહેતા..' માં નહીં સાંભળવા મળે દયાભાભીનું 'હૈ મા માતાજી..' !,entertainment
"કપિલ શર્માએ લગ્ન બાદ આપ્યું ત્રીજું રિસેપ્શન, જુઓ તસવીરો",entertainment
Bigg Bossની એક્સ સ્પર્ધક આમ એન્જોય કરી રહી છે હોલિડે,entertainment
GOOD NEWS: જુની બાઈક ખરીદનાર લોકો માટે RTOએ શરૂ કરી નવી સુવિધા,tech
"આ ટીવી એકટ્રેસે પિંક સ્કર્ટમાં કરાવ્યું હોટ ફોટોશૂટ, જુઓ PHOTOS",entertainment
PICS: શ્રીદેવીને યાદ કરીને રડી પડ્યાં જાહ્નવી અને બોની કપૂર,entertainment
"અંગત જાણકારી સુરક્ષિત રાખવા કરો Aadhaar લોક, વાંચો આખી પ્રોસેસ",business
"ટાઇગર સાથે ડિનર પર નીકળી દિશા, શ્રદ્ધાએ મિત્રો સાથે મનાવ્યો બર્થ-ડે",entertainment
"WhatsApp થી હટી ગયા આ 'Stickers', યૂઝર્સ નહીં કરી શકે ઉપયોગ",tech
3GB રેમ અને 32GB મેમરીવાળો સ્માર્ટફોન વીડિયોકોને કર્યો લોન્ચ,business
લગ્ન બાદ આ એક્ટ્રેસે કાતિલ તસવીરો શેર કરી ફેન્સને કર્યા દિવાના,entertainment
"જેટ એરવેઝે તમામ બોઇંગ 737 MAX ફ્લાઇટ બંધ કરી, શું છે કારણ?",business
"ટ્રેડિશનલ લૂકમાં સારાએ મા સાથે કરાવ્યું ફોટોશૂટ, જુઓ Pics",entertainment
"રણબીર - આલિયા એકસાથે ચમકશે 'બ્રહ્માસ્ત્ર'માં, જાણો ક્યાં થશે શૂટિંગ",entertainment
હવે બાબા સામે શ્રી શ્રી: રૂ.200 કરોડના રોકાણ સાથે ખોલશે 1000 સ્ટોર્સ,business
'વીર રસ'નાં કવિ વિનિત ચૌહાણે જ્યારે વાઘા બોર્ડર પર સંભળાવી હતી લોહી ઉકળી ઉઠે તેવી કવિતા,entertainment
"ફ્લેટ ખરીદવા પર સરકાર આપી શકે છે મોટી ગીફ્ટ, આવી રીતે બચાવો લાખો રૂપિયા...!",business
"PFના 6.25 હજાર કરોડ ખાઈ ગઈ કંપનીઓ, આવી રીતે ચેક કરો તમારૂ PF એકાઉન્ટ",business
સંજ્ય દત્તનું માધુરી સાથે હતું અફેર? પુસ્તકમાં થયો ખુલાસો,entertainment
Flipkartનો Big Billion Days Sale શરૂઃ 90% સુધીનું ડિસ્કાઉન્ટ,tech
43 વર્ષની ઉમરમાં માતા બની ટીવી ક્વીન એકતા કપૂર,entertainment
"બિગ બોસ-12 માટે ઓડિશન શરૂ, શોમાં આવશે નવો ટ્વિસ્ટ",entertainment
જો તમને કોઇએ તમારા ક્રેડિટ/ડેબિટ કાર્ડથી છેતર્યા હોય તો આટલું કરો,business
"આ છે દુનિયાની સૌથી મોંઘી કાર, કિંમત માત્ર....",tech
તનુશ્રીનાં આરોપો પર નાનાની સ્પષ્ટતા- 'કાલે જે સત્ય હતું આજે પણ તેજ સત્ય છે',entertainment
"આ સરકારી સ્કીમમાં મળે છે પેન્શનની ગેરન્ટી, રૂ. 210થી કરો શરૂઆત",business
"200 રૂપિયા સુધી કોણ આપી રહ્યું છે બેસ્ટ પ્લાન, જિયો-એરટેલ કે વોડાફોન",business
"ચાર્જર અને સિમ સ્લોટ વગરનો દુનિયાનો પહેલો મોબાઇલ ફોન લોન્ચ, આ રીતે કરશે કામ",tech
લગ્ન બાદનો પહેલો Birthday! આખરે કેવી રીતે જોડી જામી દીપિકાની રણવીર સાથે?,entertainment
બળાત્કારના આરોપમાં હોલિવૂડ પ્રોડ્યુસર હાર્વે વાઇનસ્ટીનની ધરપકડ,entertainment
બોલિવૂડની સૌથી વધુ કમાણી કરનારી પાંચમી ફિલ્મ બની 'સંજૂ',entertainment
