headline,label
'કોમોલિકા' ક્યાં ગૂમ થઇ ગઇ? બહાર આવ્યું આ તસવીરોમાં,entertainment
Appleના Logoમાં કપાયેલું સફરજન કેમ છે? જાણો - રહસ્યની વાત!,tech
"ટીવીની આ હોટ 'ડાયને' શેર કર્યો બાથરુમનો એક એવો વીડિયો, જોઇને છૂટી જશે પરસેવો",entertainment
"સોશિયલ મીડિયા પર નિકે વરસાવ્યો પ્રિયંકા પર પ્રેમ, તસવીર પર કરી ખાસ કમેન્ટ",entertainment
"1 જુનથી વધી શકે છે AC અને ફ્રીજના ભાવ, આ છે કારણ",business
બેંક તરફથી આવેલા SMSને અવગણસો તો બંધ થઈ જશે તમારું ATM કાર્ડ!,business
"Nokia X6ની માર્કેટમાં એન્ટ્રી, ત્રણ કેમેરા, iPhone X જેવી ડિસ્પલે- જાણો કિંમત",tech
ટીવીની 'કિન્નર વહુ'એ કંઇક આવી રીતે કરી જન્મદિવસની ઉજવણી,entertainment
આખરે શું છે JIOની આ નવી FTTH ટેક્નોલોજી? જાણીએ તમામ માહિતી,tech
"500 1000 રૂપિયાની નોટ ના સ્વીકારાતાં હંગામો, ટોલ નાકાએ ટ્રાફિક જામ, જુઓ તસ્વીરો",business
"અરમાન કોહલીએ GFનાં વાળ ખેંચીને સીડીથી માર્યો ધક્કો, દાખલ થઇ ફરિયાદ",entertainment
"આજે મુંબઈ પહોંચશે નહી શ્રીદેવીનું પાર્થિવ શરીર, કાનૂની દાવપેચમાં અટક્યો મામલો",entertainment
"BOB, Dena Bank, Vijaya Bank માં છે ખાતુ તો તમારા પર થશે આ અસર",business
"વિજય માલ્યાને ભારત લાવવામાં આવશે, લંડન કોર્ટે પ્રત્યર્પણની આપી મંજૂરી",business
'વૈશ્વિક સ્તર પર રોકાણ માટે ભારત સૌથી આકર્ષક',business
શું તમે જોયો 'કોમોલિકા' હિના ખાનનો નવો અવતાર?,entertainment
"સમયસર ન ભર્યુ ITR, તો લાગશે રૂ. 10000 સુધીની પેનલ્ટી",business
"Whatsappના આ યૂઝર્સને મળશે 1.8 કરોડ, આવી રીતે કરો એપ્લાય",tech
"સંજૂ બાબાનું નવુ પોસ્ટર રિલીઝ, હિરાનીએ ખોલ્યુ મોટું રહસ્ય",entertainment
"અક્ષય કુમારે પોતાને જ લગાડી આગ, તસવીર જોઇ પત્ની ટ્વિંકલે કહ્યું આવું",entertainment
દેશના રસ્તાઓ પર ટૂંક સમયમાં દોડતી નજર આવશે ઇલેક્ટ્રિક SUV,tech
"દુનિયામાં સૌથી વધારે વેચાતું છે આ સ્કુટર, રૂ. 52500માં આવ્યો તેનો 5G અવતાર",tech
રુ.119ના પ્લાનમાં મેળવો અનલિમિટેડ કોલિંગ અને દરરોજ 1GB ડેટા,tech
"શેરબજારમાં ભારે ઉછાળો: સેનસેક્સ 33,451ની સપાટીએ, નિફ્ટી 10,400ને પાર",business
"મોહમ્મદ કૈફની દીકરી છે  કેટરિના, વિશ્વાસ ન થતો હોય તો વાંચો આ સમાચાર",entertainment
"હવે આધાર નંબરને બદલે વર્ચ્યુઅલ નંબરથી કરી શકશો સરકારી વેરિફિકેશન, થયા મોટા ફેરફાર",tech
15 દિવસની રાહત પછી ફરી વધ્યાપેટ્રોલ-ડીઝલના ભાવ,business
"સારા ખાને બિકિની ફોટા કર્યા શેર, ટ્રોલર્સે કહ્યું, 'તમે મુસ્લિમ છો કંઈક તો શરમ કરો'",entertainment
1 દિવસમાં જ લોન કેવી રીતે મેળવશો? શું હોય છે સેમ ડે લોન ?,business
કંગનાની કો સ્ટાર અને ટીવીની  'સંસ્કારી વહુ'એ કરાવ્યું Bold ફોટોશૂટ,entertainment
"કરીના કપૂર બિકિનીને લઈ થઈ ટ્રોલ, આમના વેકેશન પર છે સોશિયલ મીડિયાની નજર",entertainment
"અર્જુન કપૂર સાવકી માને શ્રદ્ધાંજલિ આપવા પહોંચ્યો, વણસેલા હતા સંબંધો",entertainment
પેટ્રોલ-ડીઝલના ભાવ ઘટાડા સાથે જોડાયેલી આ 10 વાત જાણવી જરૂરી,business
"સેન્સેક્સમાં 304 પૉઇન્ટનો ઉછાળો, નિફ્ટી 10600ની પાસે",business
"Leaked : સલમાન ખાને શૂટ કર્યો 'બિગ બોસ 12'નો પ્રોમો, આવો હશે અંદાજ",entertainment
"રાત્રે 3.30 વાગ્યે સલમાનને મળવા પહોંચ્યો રેમો ડિસૂઝા, શું હતું કારણ?",entertainment
BJP MLAએ સોનાલી બેન્દ્રેને મૃત માની આપી દીધી શ્રદ્ધાંજલિ,entertainment
"25 વર્ષ નાની ગર્લફ્રેન્ડને પરણ્યો મિલિંદ, જુઓ Wedding Album",entertainment
"Avengers Infinity War Review :આ માર્વલ્સની સૌથી મહત્વકાંક્ષી ફિલ્મ છે, દર્શકો પરેશાન છે કે હવે શું થશે ?",entertainment
જાણો કેવી રીતે બનશો જિયો પ્રાઇમ મેમ્બરશિપનો હિસ્સો,business
પ્રિયંકા ચોપરાના ન્યૂયોર્ક સ્થિત ઘરની તસવીરો જોઇ દંગ રહી જશો તમે,entertainment
"પોસ્ટ ઓફિસની આ યોજનાઓનો ઉઠાવો લાભ, મળશે 8.5% સુધીનું વળતર",business
"આ SALEમાં તમને મળશે દુબઈ ફરવાનો મોકો, દરેક મિનીટે મેળવો મૂવી ટિકિટ",tech
પ્રિયાંક શર્મા શા માટે પહેરવા માંગે છે હિના ખાનની બિકીની?,entertainment
મુંબઈ : ફિલ્મ નિર્માતાનો મંદિરમાં ગળેફાંસો ખાઈને આપઘાત,entertainment
"જવાનીમાં આવી રીતે કરો પ્લાનિંગ, જિંદગીમાં નહીં રહે પૈસાની અછત!",business
સબસિડી વગરનો ગેસ સિલેન્ડર 59 રૂપિયા અને સબસિડી વાળો 2.89 રૂપિયા મોંઘો થયો,business
કોલેજની ડિગ્રીથી નહીં પણ આ 6 ગુણ તમે બનાવે છે પોતાની કંપનીમાં ‘હિટ એન્ડ ફિટ’,business
ટોટલ ધમાલનો Review: પૈસા વસૂલ છે પણ એક શરતે...,entertainment
SBIનાં ગ્રાહકોને સ્પેશિયલ સર્વિસ! હવે ATMથી પણ ઉપાડી શકાશે FDનાં રૂપિયા,business
"પાકિસ્તાનમાં 180 રૂ. કિલો ટામેટા, દેખાઇ રહી છે ભારતની કાર્યવાહીની અસર",business
"ક્રેડિટ કાર્ડ સાથે ફ્રોડ થવાના કેસમાં મળે છે વળતર, જાણો કેવી રીતે",business
"RIP! 'યે હૈ મોહબત્તે'માં નોકરાણીનો રોલ કરનારી નીલુનું નિધન, દિવ્યાંકાએ વ્યક્ત કર્યો શોક",entertainment
લગ્ન પહેલાં 'KISS'ને કારણે નિકથી નારાજ થઇ પ્રિયંકા !,entertainment
"વોટ્સએપ મેસજ સાચો છે કે ફેક, આ રીતે કરો ચેક",tech
"રાખીનો ખુલાસો- તનુશ્રીએ કર્યો છે મારો રેપ, કરાવો તેનો નાર્કો ટેસ્ટ",entertainment
"ચર્ચામાં છે દીપિકાની વેડિંગ રિંગ, આટલામાં તો અ'વાદમાં 5BHK બંગલો આવી જાય!",entertainment
"આ બાબતમાં સૌથી આગળ Reliance Jio, ટ્રાઈની રિપોર્ટમાં થયો ખુલાસો",tech
પહેલી ટ્રેનના કારણે બીજી ટ્રેન છૂટી જશે તો પાછા મળશે ટિકિટના નાણાં,business
"આર્મી ગર્લે શેર કરી BOLD તસવીરો, તેની આગળ હિરોઇન પણ ભરે પાણી",entertainment
"બંધ થઇ રહી છે Googleની આ સર્વિસ, તરત સેવ કરી લો ફોટો-વીડિયો",tech
"પુત્ર અબરામે પિતા માટે લખ્યો ખાસ મેસેજ, ઇમોશનલ થયો શાહરૂખ ખાન",entertainment
"અનિલ કપૂરે સલમાન સામે લીધુ ઐશ્વર્યાનું નામ, જુઓ ભાઇજાન થયો શરમથી લાલ",entertainment
"આપનાં આધાર કાર્ડનો ખોટી રીતે નથી થયોને ઉપયોગ, આ રીતે જાણી લો તમામ માહિતી",business
PHOTOS: 'બ્રહ્માસ્ત્ર'નાં સેટ પર ખુબજ ખુશ જોવા મળ્યા આલિયા-રણબીર,entertainment
તનુશ્રી વિવાદ બાદ શૂટિંગ પર નથી આવતા નાના પાટેકર,entertainment
અહી પ્રિયંકા ચોપડાએ પોતાના 36માં જન્મદિવસની કરી ઉજવણી,entertainment
"ગુજરાતી ફિલ્મ 'શું થયુ ?' નું ટ્રેલર રિલીઝ, જુઓ કોણ છે સ્ટાર કાસ્ટ",entertainment
"SBIએ બદલ્યો રોકડ જમા કરવાનો નિયમ, જાણી લો આ મહત્વની વાત",business
"'મણિકર્ણિકા' માં કંગનાએ જે યુદ્ધનો સીન કર્યો હતો તે ઘોડો હતો નકલી, જુઓ Video",entertainment
"બાઇક અને કાર પર પડેલા સ્ક્રેચને આ રીતે કરો દૂર, સમયની અને પૈસાની થશે બચત",tech
SBIનાં ચેરમેને કહ્યું- માલ્યા તરફથી લોન પતાવટનો કોઈ પ્રસ્તાવ નથી મળ્યો,business
IT વિભાગે 8 મહિના સુધી પોતાની પાસે રાખી નીરવ મોદીના કારનામાઓની વિગત- રિપોર્ટ,business
"Gym Goals: દીપિકાએ બતાવ્યો પોતાનો સેક્સી અવતાર, ફ્લૉન્ટ કર્યુ આરકે ટૈટૂ",entertainment
દીપિકા-રણવીર નહીં સલમાન-ઐશ્વર્યા હતા 'પદ્માવત' માટે પહેલી ચોઇસ,entertainment
"આવનાર અઠવાડિયાથી દેશભરમાં શરૂ થશે ""વોટ્સએપ પેમેન્ટ સેવા!""",tech
"ટીવી કિંગ હિતેન તેજવાનીની ચમકી કિસ્મત, સંજય-માધુરી સાથે મળી કામ કરવાની તક",entertainment
બકરી સાથે ગેંગરેપનાં આરોપીઓ માટે જ્હોન અબ્રાહમે માંગી આ સજા,entertainment
"સેન્સેક્સમાં 115 પૉઇન્ટનો ઉછાળો, નિફ્ટી 10250ની પાસે",business
"રાજનેતાના પૌત્રના પ્રેમમાં પાગલ હતી સારા અલી ખાન, કર્યો આવો ખુલાસો",entertainment
"Jioનું 'ધન ધના ધન' ઓફર, 309 રૂ.માં 3 મહિના સુધી અનલિમિટેડ સર્વિસ",business
"હવે પહેલાં જેવા નહીં દેખાય મિત્રોના WhatsApp Status, થશે આ ફેરફાર",tech
એકથી વધુ ઘર ધરાવનારા માટે ઇન્કમ ટેક્સનો આ નવો નિયમ જાણવો મહત્ત્વનો છે,business
રિલાયન્સે રૂ.1.3 કરોડમાં મીડિયા સ્ટાર્ટઅપ NEWJની ખરીદી ભાગીદારી,business
રાજકારણ અને બોલિવૂડમાં સેક્સના બદલે ફાયદો મળવાની વાત સાચીઃ શત્રુઘ્ન સિંહા,entertainment
વિરાટ કોહલીની પ્રમાણિકતા અંગે અનુષ્કા શર્માએ કહી આ ખાસ વાત,entertainment
અમદાવાદ સહિત 11 શહેરોમાં 2 કલાકમાં જ મોબાઇલ અને સિમકાર્ડની મળશે હોમ ડિલેવરી,business
"શનિવારે GST કાઉન્સિલની બેઠકમાં આ 6 વસ્તુઓ થઈ શકે છે સસ્તી, જુઓ યાદી",business
"ola-uberની જેમ ambulance પણ કરી શકશો બૂક, જાણો કેવી રીતે",tech
Trailer Out : આમિર ખાને લોન્ચ કર્યુ કમલ હાસનની 'વિશ્વરૂપ-2'નું ટ્રેલર,entertainment
'અબ તક છપ્પન' ફિલ્મના લેખકનો બિલ્ડિંગ પરથી કૂદીને આપઘાત,entertainment
સેલરીમાં કેશ ઈન હેન્ડ ઘટશે! સેલરી સ્લિપમાં પણ ફેરફારની તૈયારી,business
જ્યારે શ્રીદેવીનાં ચક્કરમાં આખો દેશ બન્યો હતો April Fool..!,entertainment
આણંદઃભંગાર સ્કુટરમાંથી પશુપાલન ક્ષેત્રે ઉપયોગી યંત્ર બનાવ્યું,business
તમારૂં આધારકાર્ડ કોઈ વાપરી તો નથી રહ્યું ને? જાણો આ રીતે,business
"CONFIRM:'ઉલ્ટા ચશ્મા..'માં પાછી ફરી દયાબેન, શૂટિંગ કર્યુ શરૂ",entertainment
"સેન્સેક્સમાં 108નો વધારો, નિફ્ટી 10180ની પાસે",business
'ધ શેપ ઓફ વોટર'ને મળ્યો બેસ્ટ ફિલ્મનો ઓસ્કાર એવોર્ડ,entertainment
એક્સ બિગ બોસ કન્ટેસ્ટન્ટ લોકેશ કુમારીએ શેર કર્યો બોલ્ડ અંદાજ,entertainment
"'ઇશ્કબાઝ'ની અનિકા બર્થડેનાં દિવસે થઇ બોલ્ડ, જુઓ photos",entertainment
"'Nestle' એ સુપ્રીમ કોર્ટમાં કબુલ્યું : ' હા, Maggi નુડલ્સમાં સીસું હતું'",business
Good News લાવશે બજેટ! મળી શકે છે ઈન્કમ ટેક્ષ કપાતની ગીફ્ટ,business
"VIDEO: ભાવૂક થઈને આમિર ખાને લોકોને કરી અપીલ, મદદ માટે માગ્યો સાથ",entertainment
"સેન્સેક્સ પહેલીવાર 38,000ને પાર અને નિફ્ટી 11,495 પાર",business
"SBIની ચેતવણી! ફેસબુક પર ભુલથી પણ ન કરો આ કામ,ખાલી થઈ શકે છે બેન્ક એકાઉન્ટ",business
દેશને સમર્પિત થનારી સૌથી લાંબી સુરંગમાં શું છે ખાસ જાણો,business
"કંગનાએ કરણી સેના પર પિત્તો ગુમાવ્યો: 'હું પણ રાજપૂત છું, ખતમ કરી દઇશ'",entertainment
"OSCAR 2019: ભારતીય ફિલ્મ 'પિરિયડ' બેસ્ટ ડોક્યુમેન્ટ્રી, વાંચો વિજેતાનું સંપૂર્ણ લિસ્ટ",entertainment
2000ની નકલી નોટોની વધતી સંખ્યા જોઇને RBIની ચિંતા વધી,business
"અહીં પુરૂ થઈ રહ્યું છે પીએમ મોદીનું મેક ઈન ઈન્ડીયાનું સપનું, 10 હજારને મળશે રોજગાર",business
ફડચામાં ગયેલી રાજ્યની રાષ્ટ્રીયકૃત બેંકમાં થાપણદારોના વીમા સુરક્ષિત કરવાની માંગ,business
જો શાહરૂખ અને સલમાન બંનેનાં ફેન છો તો આ VIDEO જોવાનું ન ચૂકતા...!,entertainment
"ભૂલથી પણ ન કરો પાન સંબંધી આ ભૂલો, નહિતર તમે ફસાઈ જશો",business
ઝોયા બનાવશે  'ઝિંદગી ન મિલેગી દોબારા'ની સિક્વલ!,entertainment
"RBI વિવાદ પર બોલ્યા નાણામંત્રી, સરકાર આગળ પણ આપતી રહેશે સલાહ",business
"Budget 2019: મહિલાઓ માટે મોટી જાહેરાત, 40,000 સુધીની લોન પર વ્યાજ નહીં",business
"આમિર ખાન નહિં આ હતો હિંદુસ્તાનનો અસલી ઠગી, જેના નામે નોંધાયા હતા 931 મર્ડર કેસ",entertainment
65 લાખ રુપિયા પહોંચી શકે છે બિટકોઈનનો ભાવ,business
રાજકોટમાં 3000સુવર્ણકારોના ભાજપમાંથી રાજીનામાં,business
"ફેસબુક પર ડેટિંગ માટે માર્ક ઝકરબર્ગે લોન્ચ કર્યું નવું ફિચર, ટિન્ડરને મળશે ટક્કર",tech
"આસામ ગ્લોબલ ઇન્વેસ્ટર્સ સમિટમાં રિલાયન્સ ગ્રુપના મુકેશ અંબાણીએ શું કહ્યું, જાણો",business
"પ્રિયંકા ચોપડાએ બોલીવૂડને આપી પાર્ટી, જુઓ ગ્લેમર્સ રિસેપ્શનની તસવીરો",entertainment
"સેમસંગ ટૂંક સમયમાં લોન્ચ કરશે ગેલેક્સી C5, જાણો સ્માર્ટફોનની વિશેષતાઓ",business
"જ્યારે આશા ભોસલેના પગે લાગી રેખા, દેખાઈ બંન્નેની અલગ જ કેમેસ્ટ્રી",entertainment
"CEOના મોત સાથે લોક થઈ અબજોની ક્રિપ્ટોકરન્સી, લાખો ગ્રાહક મુશ્કેલીમાં",business
હવે 40 લાખ સુધીનું ટર્નઓવરને GSTના દાયરામાંથી મુક્તિઃ અરુણ જેટલી,business
WhatsAppમાં હવે લખીને નહીં બોલીને ટાઇપ કરો મેસેજ,tech
"ઇન્સ્ટાગ્રામ પર યુઝરે સોફિયાને પુછ્યો 'એક રાતનો ભાવ', તેણે આપ્યો જડબાતોડ જવાબ",entertainment
Photos: કપિલની નવી તસવીરો જોઈને તમને લાગશે આઘાત!,entertainment
"નવેમ્બરમાં લોન્ચ થશે લાજવાબ કાર, જુઓ શું હશે કિંમત અને ખાસિયત",tech
ગ્લેમર ઈંડસ્ટ્રીની આ 3 હસીના સાથે બોલ્ડ થઈ ચૂક્યા છે હાર્દિક  !,entertainment
આ ખાસ કારણે માધુરીએ 21 વર્ષ બાદ સંજય સાથે કામ કરવાની પાડી 'હા'....!,entertainment
"મળો, સંજય દત્તનાં સાચા મિત્રને, જેનો રોલ વિકી કૌશલે કર્યો છે અદા",entertainment
"CBSEનું ધો-12નું પરિણામ 26મી મેના રોજ, આ મોબાઇલ એપ પર જુઓ",tech
'સાવધાન ઈન્ડિયા'ના હોસ્ટ સુશાંત સિંહની બહેનને થઈ ગંભીર બીમારી,entertainment
"મુશ્કેલીમાં ફિલ્મ કેદારનાથ, બોમ્બે હાઈકોર્ટમાં અરજી દાખલ",entertainment
"સ્વીમશૂટમાં આ એક્ટ્રેસ સાથે થયુ કંઇક આવું, વીડિયો થયો વાયરલ",entertainment
highlights of budget 2016 : જાણો પાંચ મિનિટમાં બજેટ 2016ની વિગતો,business
શું ડ્રગ્સના ઓવરડોઝને કારણે થયું શ્રીદેવીનું મોત?,entertainment
"AR રહેમાનની દીકરી ફરી બુરખો વગર આવી સામે, વાયરલ થઈ તસવીર",entertainment
"આમિરની મહાભારત પહેલા કોહલી બનાવશે રામાયણ, આવી હશે સ્ટાર કાસ્ટ",entertainment
"ઉત્તર પ્રદેશનાં ખેડૂતોનું દેવું ચુકવવાનો બિગ બીનો નિર્ણય, 70 ખેડૂતોને બોલાવ્યા મુંબઇ",entertainment
"Xiaomi Mi TV 4ને સરળ હપ્તે ખરીદવાની ઓફર, સાથે મળશે ડિસ્કાઉન્ટ",tech
બાળ અધિકાર સંરક્ષણ આયોગે PUBGને બાળકો માટે 'નુકસાનકારક' અને 'નકારાત્મક' ગણાવી,tech
"રિયા ચક્રવર્તીએ શેર કરી હોટ ફોટોશૂટની તસવીરો, ફેન્સે કર્યો લાઇક્સનો વરસાદ",entertainment
VIDEO: જુઓ 'અલ્લાહ દુહાઇ..' સોન્ગમાં કેટલી ભૂલો બાદ ડાન્સ શીખ્યો સલમાન,entertainment
'The Accidental PM' ફિલ્મમાં આ એક્ટ્રેસ બની સોનિયા ગાંધી,entertainment
SBI પોતાના ગ્રાહકોને મોકલી રહી છે ખાસ SMS! નહીં તો થશે એકાઉન્ટ બ્લોક,business
"હવે WhatsApp પર જાણી શકાશે લોન મળશે કે નહી, ફ્રીમાં આ રીતે કરો ચેક",tech
"GST : અફવાનું રિયાલિટી ચેક, આખરે શું છે સત્ય ? જાણો",business
"જો કરી આ ભૂલ તો, WhatsApp થઇ શકે છે બ્લોક",tech
