headline,label
હવે શું ચીન પણ બગડ્યું પાકિસ્તાન પર? બંધ કરી આ સેવા,business
"નોટબંધીથી હાલ તકલીફ છે, પણ લાંબે ગાળે જરૂર ફાયદો થશે",business
"આ Mother's Day પર 'મા 'માટે કરો આ કામ, મોદી સરકાર આપશે હજારોની ગિફ્ટ",business
"કબૂતરબાજી મામલામાં દલેર મહેંદીને રાહત, કોર્ટે સજા પર લગાવી રોક",entertainment
"પ્લાસ્ટિકની ખાલી બોટલોથી કરો કમાણી, એક કિલોના મળશે રૂ.15",business
મુંબઇ એરપોર્ટ પર મો છુપાઇને જ્યારે પહોંચ્યા હતા સ્ટાર્સ,entertainment
તસવીરોમાં જુઓ 23 વર્ષમાં આટલી બદલાઇ DDLJની સ્ટાર કાસ્ટ,entertainment
"સોનમ આનંદ બાદ થશે રણવીર-દીપિકાના લગ્ન, સ્ટાફમાં તમામની રજાઓ થઇ કેન્સલ",entertainment
PHOTOS: વિવાદોમાં ઘેરાયેલી સારા ફરી એક વખત બહેન સાથે બિકિની પહેરી પાણીમાં ઉતરી,entertainment
"Redmi Note 7નો પહેલો સેલ આજે, Jio આપી રહ્યું છે ડબલ ડેટા અને રૂ.2400નું કેશબેક",tech
"એમેઝોન-ફ્લીપકાર્ટ સેલ: ડેબિટ કાર્ડથી EMI કેવી રીતે લેવાય, સમજો - એક-એક સ્ટેપ",tech
"મોદી સરકારની ટેક્સટાઈલ સેક્ટરને GIFT, મળશે 5 કરોડ લોકોને રોજગારી",business
B'day: 'બાહુબલી'ની માતા શિવગામીનો આ 'ખલનાયક' અવતાર નહીં યાદ હોય તમને!,entertainment
"ઓછા રોકાણમાં શરૂ કરો બિઝનેસ, દર મહિને એક લાખથી વધારે થશે કમાણી",business
"ઇમરાન હાશ્મીના પુત્રે કેન્સર સામે મેળવ્યો વિજય, 5 વર્ષ ચાલી સારવાર",entertainment
"પાંચ કરોડ ફેસબુક યુઝર્સનાં એકાઉન્ટ હેક, કંપનીએ માંગી માફી",tech
"ભારતમાં લોન્ચ થઇ ઇલેક્ટ્રિક સાયકલ, એકવાર ચાર્જિંગથી ચાલશે 35KM",tech
"આનંદો : મબલખ મગફળીથી સિંગતેલ થયું સ્થિર, જોવો ખાસ અહેવાલ VIDEO",business
"'ધ્રૂમપાન પડેગા મહેંગા' વાળી બાળકી અત્યારે આવી લાગે છે, નહીં થાય વિશ્વાસ!",entertainment
"આજે છે અહી છેલ્લી તક, માત્ર 299 રુપિયામાં ખરીદો મોબાઇલ ફોન",tech
અમેરિકાના રાષ્ટ્રપતિ ડોનાલ્ડ ટ્રમ્પે વધાર્યો ભારતીય લગ્નોનો ખર્ચ!,business
ફોટોગ્રાફર્સને પોઝ આપતા સમયે દિયર ઈશાન પર રોષે ભરાઈ ભાભી મીરા,entertainment
નોકરી કરનાર માટે મોટી ખબર!  PF પર સુપ્રીમ કોર્ટે સંભળાવ્યો આ નિર્ણય,business
"વિદેશમાં નિકાસ કરતા ખેડૂતોને વિમાન-દરિયાઇ ભાડામાં 25%નો લાભ અપાશે,4 કોલ સ્ટોરેજ બનાવાયા",business
જન ધન ખાતામાંથી હવે મહિનામાં માત્ર 10000 રૂપિયા જ ઉપાડી શકાશે,business
"ક્યારે લોન્ચ થશે iphone SE 2, જુઓ કેવો હશે તેનો લૂક?",tech
"તો શું ભારતમાં નહીં, વિદેશમાં લગ્ન કરશે રણવીર-દીપિકા?",entertainment
"વડાપ્રધાન નિવાસે મોડી રાતે મળી બેઠક, જુની નોટની મુદત વધારાઇ, શું થઇ ચર્ચા? જાણો",business
"ટેક્સ સેવિંગ અને ઘણાં ફાયદાઓ માટે અહીં કરો ઈન્વેસ્ટ , મળશે મોટું વળતર",business
સાડીની સાથે સ્પોર્ટ્સ શૂઝ કેમ પહેરે છે રેખા?,entertainment
"UPI એપથી રૂપિયાની લેવડદેવડ થશે સરળ, જોવો Video",business
"Leaked Photo: લગ્નમાં રણવીર સિંઘનો પહેલો લૂક, આવો લાગતો હતો વરરાજા!",entertainment
Bigg Boss-12:સલમાનની સાથે જોવા મળશે ખાસ 'પાર્ટનર',entertainment
"અમદાવાદમાં થયુ છે હિન્દી ફિલ્મ 'મિત્રો'નું શૂટિંગ, પ્રતિક ગાંધીનો છે ખાસ રોલ",entertainment
"ગૂગલે લોન્ચ કરી નવી ઓપરેટિંગ સિસ્ટમ Android Pie, શાનદાર છે ફિચર્સ",tech
"કવિ તુષાર શુક્લએ ભારતની કાર્યવાહી પર લખી કવિતા, મોદીનો માન્યો આભાર",entertainment
શમા સિકંદરની હોટ તસવીરો સોશિયલ મીડિયામાં થઇ રહી છે વાયરલ,entertainment
"પાકિસ્તાનમાં શૂટ કરવામાં આવી છે આ શોર્ટ ફિલ્મ, જોઈને ઓળખી નહીં શકો તમે",entertainment
ખુશખબરી! મોદી સરકાર Incom Taxમાં આપી શકે છે આટલી છૂટ,business
"PHOTOS: મિસ યુનિવર્સ 2018 સ્પર્ધા, જુઓ બિકિની રાઉન્ડમાં સુંદરીઓનો જલવો",entertainment
"""ઠગ્સ ઑફ હિન્દોસ્તાન""ને મળ્યું રૂ. 50 કરોડોનું બમ્પર એડવાન્સ બુકિંગ",entertainment
3 મહિના સુધી મફતમાં મળશે 100 GB હાઇ સ્પીડ ડેટા Jio GigaFiber માં,business
આવનારા દસકામાં ભારતનું સૌથી ઝડપી વિકસિત અર્થતંત્ર: હાર્વર્ડ યુનિવર્સિટી,business
"અપડેટ કરતા સમયે iPhone Xમાં થયો બ્લાસ્ટ, યુઝરે ટ્વીટ કરીને આપી માહિતી",tech
"આરબીઆઇ ગવર્નર ઉર્જિત પટેલે ના આપી રાહત, ઇએમઆઇ યથાવત",business
આનંદો! આવતા મહિને આ કંપની લૉન્ચ કરશે દુનિયાનો પ્રથમ 5G ફોન,tech
"આ હસીનાએ ફરી વિખેર્યા હુશ્નના જલવા, તસવીરો વાયરલ",entertainment
"અડધી કિંમતે આવી રીતે બૂક કરાવો ટ્રેનની ટિકિટ, રેલવે આપી હતી માહિતી",business
લાખો રૂપિયાના ફોનને પછાડે એવા છે ફિચર માત્ર રૂ.2000ના મોબાઇલમાં,tech
"ગાંધીનગર: ગીફ્ટ સીટીને ગીફ્ટ, CMએ SBIના હેડ ક્વાર્ટરનું કર્યું ભૂમિપૂજન",business
"ભારતીયોની માથાદીઠ આવકમાં થયો મોટો ઉછાળો, જાણો કેટલી વધી",business
"Box Offcie: છવાઇ ગઇ વિક્કી કૌશલની 'ઉરી', વાંચો 3 દિવસની છપ્પર ફાડ કે કમાણી",entertainment
"આજે જ પતાવી લો બેંકનું કામ, આગામી ત્રણ દિવસ સુધી બંધ રહેશે બેંક",business
"આ કારણે બંધ થશે 2.26 લાખ કંપનીઓ, જોઈએ શુ છે પુરો મામલો?",business
"જાણીતા ઈસ્કોન ગ્રુપ પર ITના દરોડા,અમદાવાદ-વડોદરામાં 30 જગ્યાએ એક સાથે તપાસ",business
વીજળીના મીટરવાળા લોકોને મળશે 5 લાખનો મેડિકલ વીમો free,business
મુમતાઝના મોતના સમાચાર અંગે દીકરી તાન્યાએ ફોટો શેર કરી આપ્યો ખુલાસો,entertainment
"આજે દેશભરમાં જવેલર્સની એક દિવસની હડતાળ,પાનકાર્ડની ફરજિયાત કોપી મામલે વિરોધ",business
ફક્ત 101 રૂપિયામાં ઘરે લઇ જાઓ VIVOનાં આ શાનદાર સ્માર્ટફોન,tech
"સુર્યની રોશનીથી બનશે ઇંધણ, થશે ઘરનું દરેક કામ",tech
ભારતના 9 અમીરો પાસે દેશની 50% સંપત્તિઃ રિપોર્ટ,business
"નોટે ભારે કરી, ક્યાંક લગ્ન અટવાયા તો કોઇનો વેપાર, શું છે સ્થિતિ? જાણો",business
PM મોદીનું અમેરિકામાં મિશન ઇન્વેસ્ટ ઇન ઇન્ડિયા,business
"'Bhabi Ji' સૌમ્યા ટંડના ઘરે લાગી આગ, થઇ ઇજાગ્રસ્ત",entertainment
Teaser Out: કપિલ શર્માનાં આસું લુછતો નજર આવ્યો ચંદન પ્રભાકર,entertainment
આંતરરાષ્ટ્રીય બજારમાં સોના-ચાંદીમાં દબાણની સ્થિતી,business
ખુશખબર! JioPhoneમાં શરૂ થયું WhatsApp,tech
Tata Hexaની ડ્રાઇવર લેસ કારનું થયું સફળ પરીક્ષણ,tech
"કર્ણાટકમાં મત ગણતરી વચ્ચે ગગળ્યો રૂપિયો, દોઢ વર્ષના સૌથી નીચા સ્તર પર",business
"Xiaomiના આ Smart TV પર સેલ શરુ, ઉઠાવો ઓફરનો લાભ",tech
"LICએ બંધ કરી દીધી આ પોલિસી, જો તમારે પાસે છે તો જાણો હવે શું કરવું?",business
ફોનનાં Back Buttonમાં છુપાયેલ આ  Secret Trickને નહીં જાણતા હોય તમે,tech
Oscars 2019: રેડ કાર્પેટ પર હોલિવૂડ સ્ટાર્સનો જલવો,entertainment
Paytm જેવા E-Walletમાં પૈસા રાખો છો? સરકાર લેશે આવો નિર્ણય,tech
"આ કંપનીના યૂઝર્સને દરરોજ મળશે 35GB ઇન્ટરનેટ ડેટા, જાણો શું છે પ્લાન",tech
આવી રીતે WhatsApp પોતાના ફોટોનું બનાવ્યો STICKER,tech
SBIની મોટી ઓફરઃ મફતમાં મળી રહ્યું છે પાંચ લીટર પેટ્રોલ! જાણો પ્રોસેસ,business
"EXCLUSIVE: ટૂંક સમયમાં ઘટી શકે છે પેટ્રોલ-ડીઝલના ભાવ, સરકાર લેશે પગલાં",business
"'જન્નત' ગર્લ સોનલ ચૌહાણ મનમોહક અંદાજમાં થઇ ક્લિક, તસવીરો",entertainment
MeToo: રેપના કથિત આરોપી સુભાષ ઘઇ વિરુદ્ધ ફડણવીસ સરકારનું કડક વલણ,entertainment
"ધર્મશાલામાં થઇ આ બોલ્ડ એક્ટ્રેસ સાથે છેડતી,બોલી- 'મારા સ્તનને તાકતા હતા તે લોકો'",entertainment
નોકરી કરતા લોકો માટે ખુશખબરી! સેલરી વધારાના મામલામાં ભારત રહેશે Top પર: રિપોર્ટ,business
"રિલાયન્સ Jioનો નફો 22 ટકા વધી 813 કરોડ રૂપિયા, 28 કરોડ ગ્રાહકો થયા",business
શહેરવાસીઓને ખેતી શીખવાડવા માટે શહેરોમાં જ થઈ રહી છે કોમર્શિયલ ફાર્મિંગ,business
આ 3 રીતથી ઘરે જ મોબાઈલને આધાર સાથે કરો લિંક,business
બોલ્ડ અને બ્યુટિફૂલ અદિતી રાવ હૈદરીની તસવીરો ઇન્ટરનેટ પર વાઇરલ,entertainment
ગંભીર બિમારી સામે ઝઝૂમી રહેલા ઈરફાન ખાને લીધો આ નિર્ણય,entertainment
"Samsung  Galaxy M30 સ્માર્ટફોન પર આજે સેલ, મેળવો 3110 રુપિયાનો ફાયદો",tech
Nokiaના આ લેટેસ્ટ બજેટ સ્માર્ટફોનના પ્રી-બુકિંગ ઉપર મેળવો રૂ.1800નું કેશબેક,tech
મેહુલ ચોકસીએ કોર્ટને કહ્યું- 41 કલાકની મુસાફરી કરી ભારત નહીં આવી શકું,business
ડાયરામાં બસ આ જ બાકી રહી ગયું'તું કે શું? એ પણ તબલા સાથે!,entertainment
KBC 10: સાત કરોડનો 'સાચો જવાબ' આપીને પણ હારી ગઇ બિનિતા જૈન!,entertainment
ટૂંક સમયમાં પેટ્રોલ-ડીઝલની કિંમતમાં થઈ શકે છે રૂ. 4થી 5નો ઘટાડો,business
"'સિંબા'નું ત્રીજુ સોન્ગ 'આલા રે આલા' રિલીઝ, જુઓ રણવીરની ફૂલઓન એનર્જી",entertainment
"સેક્સ ડોલ્સ કંઇક આ રીતે કરવામાં આવે છે તૈયાર, બે લાખ રુપિયા છે કિંમત",tech
કોપી કરવામાં પાછળ નથી આપણી બોલિવૂડ હસીનાઓ,entertainment
"TVની 'કિન્નર વહુ' છે ઇન્ટરનેટ સેંસેશન, ફરી શેર કરી બોલ્ડ તસવીરો",entertainment
DeepVeerનાં Receptionમાં બોલિવૂડના સિતારાઓ દેખાયા એકદમ સ્ટાઇલમાં,entertainment
સબસિડી અને બિનસબસિડીવાળાં ગૅસ-સિલિન્ડરના ભાવમાં ઘટાડો,business
"'છપ્પાક'ની શૂટિંગ પહેલાં ફિટ થઇ રહી છે દીપિકા પાદુકોણ, જિમમાં પાડ્યો પરસેવો",entertainment
ધગધગતા તાપમાં તમારા હેલમેટને AC જેવી ઠંડક આપશે આ ગેજેટ,tech
"મારૂતિ ભારતમાં રજૂ કરી શકે છે આ કાર, 1 લીટરમાં 32KM માઈલેજ",tech
"'દેશી ગર્લ'ની બેચલરેટ પાર્ટીમાં પરિણીતિ અને ઇશા અંબાણીએ રાખ્યો રંગ, જુઓ PHOTOS",entertainment
"માથામાં સિંદૂર, સફેદ સાડી અને કાળા ચશ્મા પહેરીને રેખાએ આપ્યો પોઝ",entertainment
'બાહુબલી' સ્ટાર પ્રભાસે ફગાવી કરણ જોહરની ફિલ્મ?,entertainment
"WhatsApp પર જ જોઇ શકશો વીજળી બિલ, આ રીતે કરો એપ્લાઇ",tech
"સરકારની ડિમાંડને WhatsAppએ ફગાવી, કહ્યું- યૂઝર્સની પ્રાઈવેસી જરૂરી",tech
NickYanka Wedding Pics: લગ્ન માટે મહેમાનો પહોચ્યા જોધપુર,entertainment
"બજેટ2017: મામુલી વધારા સાથે ખુલ્યું શેર બજાર, બ્રેકિંગ શેરોમાં તેજી",business
"રાજકોટ મનપામાં નાગરિકોએ એક જ દિવસમાં રૂ.1કરોડનો ટેક્સ જમા કરાવ્યો,રોજનો 6લાખનો વેપાર 60 હજારે પહોચ્યો",business
હવે પહેલાથી જ જાણી શકાશે કે વેઇટિંગ ટિકિટ કન્ફર્મ થવાના કેટલી શક્યતા છે,business
આ હિરો જે ફિલ્મ કર્યા બાદ પ્રમોશન છોડી જતો રહ્યો હિમાલય,entertainment
આ રીતે રોકાણ કરવાથી 30 વર્ષમાં બનશો 5 કરોડના માલિક!,business
"ડોલર સામે રૂપિયો ઉંધા માથે, પ્રથમ વખત 72થી નીચે, જાણો કોને થશે વધુ નુકશાન",business
નવા વર્ષની ભેટઃ ફિલ્મની ટિકિટ સહિત આજથી 23 વસ્તુ થઈ સસ્તી,business
Photos: બ્લેક આઉટફિટમાં પ્રિયંકાનું નિખરી ઉઠ્યું સૌંદર્ય,entertainment
Truecallerના આ નવા ફિચર્સથી તમારી મુશ્કેલી થઇ જશે આસાન,tech
"Violinist બાલાભાસ્કરનું નિધન,  અઠવાડિયા પહેલા અકસ્માતમાં દીકરીનું થયુ હતું મોત",entertainment
"ICICI બેંકના CEO ચંદા કોચર રજા પર, સંદીપ બક્ષી સંભાળશે કામ",business
OnePlus 5Tને ટક્કર આપી રહ્યો છે મોટોરોલાનો આ સ્માર્ટફોન,tech
"OMG: ગીતા માં સાથે પ્રેંક કરવું ક્રૂ મેંમર્સને પડ્યું ભારે, જાણો પછી શું થયું?",entertainment
અમિતાભ બચ્ચને રણવીર સિંહને આપ્યું આ ખાસ નામ,entertainment
"ફિલ્મ ‘ઠગ્સ ઓફ હિન્દોસ્તાન’નું પ્રથમ ગીત રિલીઝ, અમિતાભ, આમિરનો જલવો",entertainment
PNBકૌભાંડઃ નીરવ મોદીની કંપનીઓમાંથી જપ્ત કરાયેલા હીરા-જવેરાતના મૂલ્યને લઈ વેલ્યુઅરોમાં અસમંજસ,business
તસવીરોમાં જુઓ દીપિકા તેના રોયલ લગ્નમાં કેવા કપડાં પહેરશે,entertainment
31 માર્ચ પછી તમે નહીં ખરીદી કે વેચી શકો આ પ્રકારનો સમાન,business
બજારમાં 'રોકડ જ રાજા'  નોટબંધી નિષ્ફળ: માર્કેટમાં 1.25 લાખ કરોડની રોકડ વધી,business
બાળક મોબાઇલમાં શું જુવે છે તેની 60 ટકા માતાપિતા વોચ  નથી રાખતા,tech
ડિજીટલ ટ્રાન્ઝેક્શન વધારવા શું હવે સરકાર ચેકબુક પણ કરશે બંધ?,business
"Budget 2016 LIVE :ઇન્કમટેક્ષ સ્લેબમાં કોઇ ફેરફાર નહીં, સોનું, સિગારેટ, કાર, કપડાં મોંઘા થયા",business
'ધ કપિલ શર્મા શો' બાદ સલમાન ખાન લાવશે નવો ટીવી શો,entertainment
બજારમાં આવ્યો ચોકાવનારી કિંમતમાં 3GBરૈમ વાળો આ HDસ્માર્ટફોન,business
રાકેશ મેહરાની ફિલ્મ 'તૂફાન'માં બોક્સર બનશે ફરહાન અખ્તર,entertainment
ફિલ્મ સ્ટૂડિયોની બહાર જોવા મળ્યો બેબોની અદાઓનો જલવો,entertainment
"બીમારીમાં છોડી જતો રહ્યો પતિ, સલમાને કરી મદદ, આજે બિલકુલ ફિટ છે એક્ટ્રેસ",entertainment
આ સસ્તા પ્લાનમાં હર રોજ મળશે 3GB ડેટા અને ફ્રી અનલિમિટેડ કોલ,tech
TVની આ એક્ટ્રેસે સોશિયલ મીડિયા પર શેર કરી હોટ યોગાની તસવીર,entertainment
"2 અઠવાડિયા સુધી કબડ્ડીની ટ્રેનિંગ લેશે કંગના, કારણ છે ખાસ",entertainment
જેટલીની બજેટ પોટલીમાં કેવું છે આવકવેરાનું માળખું? જાણો,business
IRCTCથી ટિકિટ બુક કરાવનારા લોકો માટે શરૂ થઈ રહી છે આ નવી સુવિધા,business
"Galaxy M સિરીઝ માટે સેલ શરૂ, Jio યૂઝર્સને 10 મહિના ડબલ ડેટાની ઓફર",tech
'પદ્માવત' રિલીઝ પહેલા જ આ 5 ડાયલોગ મચાવી રહ્યાં છે ધૂમ,entertainment
આ મહિનાથી કારોની કિંમતોમાં વધારો કરશે મારૂતિ સુઝુકી,business
"બોલિવૂડનાં આ સેલિબ્રિટી કપલે શેર કર્યો વર્કઆઉટ ફોટો, ઓળખો કોણ છે તે?",entertainment
"ડ્રોનના કોમર્શિયલ યૂઝ માટે ડિસેમ્બરથી મળશે મંજૂરી, 250 ગ્રામથી ભારે હશે તો લાઈસન્સ જરૂરી",business
"Instagramમાં આવશે Video ચેટ, કંઇક આવો હશે નવો લૂક",tech
આ છે દુનિયાની સૌથી મોંઘી બાઈક્સ,tech
Photos : TVની  સેક્સી 'ડાયન'એ બિકીની પહેરી પાણીમાં લગાવી દીધી આગ,entertainment
"સેન્સેક્સમાં 35 પૉઇન્ટનો વધારો, નિફ્ટી 10590ની નજીક",business
પ્લેન કરતા પણ વધારે છે આ ઈલેક્ટ્રીક કારની સ્પીડ,tech
યુવતીઓ પોતે જ કાંડ કરે છે અને પછી આરોપ લગાવે છે :કૃષ્ણા અભિષેક,entertainment
"નોકરી જોઇએ છે તો  Google આપી રહ્યુ છે નવો ઑપ્શન, શું તમે કરી ટ્રાય?",tech
"LGએ K-સીરિઝમાં લોન્ચ કર્યો સ્માર્ટફોન LG K30, જાણો ફીચર્સ અને કિમત",tech
"બાળકો માટે લોન્ચ થયો આ ફોન, જાણો તેના ફિચર્સ",tech
"CNBC-TV 18 ના ""ઇન્ડિયા બિઝનેસ લિડર્સ એવોર્ડ""માં અરુણ જેટલી આપશે હાજરી",business
